{
  "product_id": "hso-plugin",
  "plugin_version": "0.1.0-real-staging1",
  "release_channel": "pilot",
  "license_id": "lic-final-real-staging-pilot-001",
  "bound_domain": "electri-c-ity-studios-24-7.com",
  "package_url": "local://site-optimizer-bridge-0.1.0-real-staging1-electri-c-ity-studios-24-7-com-root-private.zip",
  "package_checksum": "0615482839e367ada19aeff213058dad5f97826662afccea6cdcc765a3a8dcc4",
  "policy_version": "2026-03-30-final-real-staging-pilot",
  "rollback_version": "rb-final-real-staging-pilot-001",
  "allowed_scopes": [
    "homepage_only",
    "feature:meta_description",
    "feature:head_diagnostics",
    "feature:structure_visibility_diagnostics"
  ],
  "required_features": [
    "meta_description",
    "head_diagnostics",
    "structure_visibility"
  ],
  "conflict_blocklist_version": "real-staging-pilot-v1",
  "min_plugin_version": "0.1.0-real-staging1",
  "issued_at": "2026-04-19T21:00:00Z"
}
